title,doi,url,eISSN,keywords,abstract,Notes
"Nutrient intake, digestibility and growth performance of Washera lambs fed natural pasture hay supplemented with graded levels of Ficus thonningii(Chibha) leaves as replacement for concentrate mixture",https://doi.org/10.1186/s40066-018-0182-4,,,Concentrate mixture;Ficus thonningii leaves;Grass hay;Washera lambs,"The huge livestock resources of the country could not be used to its potential due to lack of good-quality feed throughout the year. Consequently, finding alternative feed supplements for livestock is an important step to sustain livestock production in the country. Ficus thonningii leaf is one of the potential feed resources for ruminants in the area. The experiment was conducted with the objective of evaluating the nutrient intake, digestibility and growth performance of local lambs fed natural pasture hay (NPH)-based diet supplemented with graded levels of Ficus thonningii dried leaves (FTL) and determining of the optimum level for replacing of concentrate mixture (CM). Twenty intact male yearling Washera lambs with initial body weight of 17.06 + 1.43 (mean + SE) kg were used in experiment. The experiment was conducted using randomized complete block design having four replications with five dietary treatments. The treatments were T1 = NPH + 0 g FTL +215 g CM; T2 = NPH + 112.5 g FTL +161.25 gCM; T3 = NPH + 225 g FTL +107.5 g CM; T4 = NPH + 337.5 g FTL + 53.75 g CM; and T5 = NPH + 450 g FTL +0 g CM. Data were analyzed using the general linear model procedures of SAS (version 9.3; 2002).",
Nutritional potential of bamboo leaves for feeding dairy cattle,https://doi.org/10.1590/1983-40632019v4954370,,,Fodder; in vivo digestibility; woody grass,"Feed shortage during the dry season in the highlands of Madagascar negatively impacts the dairy cattle productivity, as well as the farmers’ income. Bamboo can produce a high quantity of biomass and could be an alternative way to increase the fodder supply for cattle. The present study aimed to assess the compositional information and the optimal rate of bamboo as fodder for dairy cattle. Leaf samples from nine bamboo species were collected to determine their chemical composition and nutritive value. A feeding experiment was also conducted using ten dairy cows, over ten weeks. Bamboo leaves were mixed with maize silage in five proportions: SIL0:BAM100, SIL25:BAM75, SIL50:BAM50, SIL75:BAM25 and SIL100:BAM0. The contents of dry matter, total ash and crude protein in the bamboo leaves were, respectively, 44.5-64.6 %, 6.68-18.5 % and 7.71-15.4 %. In the feeding trial, the dry matter intake of bamboo leaves was 1.6-7.1 kg per day, with an average of 4.8 kg per day. The dry matter apparent digestibility of bamboo leaves was 37.4-56.4 %. The milk production reached 13.6-14.4 L per cow, per day, but there was no significant difference concerning the rate of bamboo leaves in the mixed diet (p > 0.05). The introduction of bamboo leaves into the ruminants diet did not affect their milk production.
",
"Forage Preference, Voluntary Intake, and In Vivo Digestibility of Six Tropical Tree Leaves by Sheep in Semi-Arid Areas in Benin Republic (West Africa)",https://doi.org/10.3390/su16062270,,, forage trees; nutritive value; neutral detergent fiber; productivity; sustainable,"Livestock supplementation with forage trees is becoming a sustainable alternative to traditional grazing on the open pastures during the dry season in Benin. However, little is known about the feeding preferences of sheep and the digestibility of such native tree/shrub fodder. Such knowledge could improve their use on smallholder farms. Multiple-choice feeding preference tests were conducted on six tree fodders (Annona senegalensis, Blighia sapida, Cassia sieberiana, Gmelina arborea, Khaya senegalensis, and Mangifera indica) to determine the best choice to feed the local rams and ewe Djallonke sheep. The cafeteria test involved four rams and four ewes. In addition, an in vivo trial using metabolic cages was conducted to evaluate the voluntary intake of dried woody leaves and the dry matter digestibility of diets containing these dried leaves. Preferences varied significantly (p ≤ 0.05) according to the woody species. Based on relative intake values, sheep preferred, in decreasing order, the leaves of M. indica, B. sapida, K. senegalensis, G. arborea, A. senegalensis, and C. sieberiana. The apparent digestibility of dry matter was highest (p ≤ 0.01) in the G. arborea diet (86.8%); all diets presented a value higher than 70%. This study provided helpful information about better resource utilization to improve animal productivity. Further study could evaluate the growth performance of sheep supplemented with tree fodder.",
Prediction of dry matter intake and gross feed efficiency using milk production and live weight in first-parity Holstein cows,https://doi.org/10.1007/s11250-022-03275-8,,,Correlation;Easy-to-measure traits;Feed intake;Feed efficiency;Stepwise regression,"Direct measurement of dry matter intake (DMI) presents a major challenge in estimating gross feed efficiency (GFE) in dairy cattle. This challenge can, however, be resolved through the prediction of DMI and GFE from easy-to-measure traits such as milk production (i.e. milk yield, energy-corrected milk (ECM), butterfat, protein, lactose) and live weight (LW). The main objective of this study was, therefore, to investigate the feasibility of predicting dry matter intake and gross feed efficiency for first-parity Holstein cows using milk production traits and LW. Data comprised of 30 daily measurements of DMI and milk production traits, and 25 daily LW records of a group of 100 first-parity Holstein cows, fed a total mixed ration. Gross feed efficiency was calculated as kg ECM divided by kg DMI. The initial step was to estimate correlations of milk production traits and LW with DMI and GFE, to identify the best potential predictors of DMI and GFE. Subsequently, a forward stepwise regression analysis was used to develop models to predict DMI and GFE from LW and milk production traits, followed by within-herd validations. Means for DMI, butterfat yield (BFY) and LW were 21.91 ± 2.77 kg/day, 0.95 ± 0.14 kg/day and 572 ± 15.58 kg/day, respectively. Mean GFE was 1.32 ± 0.22. Dry matter intake had positive correlations with milk yield (MY) (r = 0.32, p < 0.001) and LW (r = 0.76, p < 0.0001) and an antagonistic association with butterfat percent (BFP) (r =  − 0.55, p < 0.001). On the other hand, GFE was positively associated with MY (r = 0.36, p < 0.001), BFP (r = 0.53, p < 0.001) and BFY (r = 0.83, p < 0.0001), and negatively correlated with LW (r =  − 0.23, p > 0.05). Dry matter intake was predicted reliably by a model comprising of only LW and MY (R2 = 0.79; root mean squared error (RMSE) = 1.05 kg/day). A model that included BFY, MY and LW had the highest ability to predict GFE (R2 = 0.98; RMSE = 0.05). Live weight and BFY were the main predictor traits for DMI and GFE, respectively. The best models for predicting DMI and GFE were as follows: DMI (kg/day) =  − 54.21 − 0.192 × MY (kg/day) + 0.146 × LW (kg/day) and GFE (kg/day) = 4.120 + 0.024 × MY (kg/day) + 1.000 × BFY (kg/day) − 0.008 × LW (kg/day). Thus, daily DMI (kg/day) and GFE can be reliably predicted from LW and milk production traits using these developed models in first-parity Holstein cows. This presents a big promise to generate large quantities of data of individual cow DMI and GFE, which can be used to implement genetic improvement of feed efficiency.",
Reproductive and Lactation Characteristics of West African Dwarf Goats Offered Moringa oleifera Herbage Supplement,NA,,,lactation characteristics;Moringa oleifera herbage supplement;reproduction;West African Dwarf goats,"Humans have identified milk (product from female mammary gland) as a major source of protein and have recommended it for all ages. Humans have relied heavily on livestock, especially ruminants for intake. Among these ruminants, milk from cattle has been most used and researched into. Small ruminants (sheep and goat) also produce milk and are of growing interest recently. Among goats, the Saanen breed has been the “New Jersey” with about 3 liters of milk yield daily (Gőkdai et al. 2020). West African Dwarf goat is the predominant breed in Southern Nigeria. It produces a low quantity of milk when compared with other goat breeds (Devendra and Burns, 1983; Adebambo et al. 1994; Ojoawo and Akinsoyinu, 2014). Valerie (1996) reported that West African Dwarf (WAD) goats produce low milk when compared with other nonseasonal breeds with milk yield of 0.3 kg/day and had contributed to the low growth rate in the offsprings. However, it had been observed that remarkable improvement can be achieved under improved nutrition and management conditions (Milerski and Mares, 2001). Nutrition plays a major role in milk quantity and quality. One of the identified ways of assessing milk yield has been to assess the nutrition of the dairy ruminants (Milerski and Mares, 2001). This has usually been done with concentrate diets. However, ruminants depend on forage for survival (Banerjee, 2013). The response of ruminants in terms of performance and reproductive characteristics is being assessed using multipurpose trees. One of such trees of global interest is Moringa oleifera. Moringa oleifera leaf meal has been reported to increase feed intake, nutrient digestibility, reduced worm load, replaced conventional mixed concentrate and did not pose a health threat when included in diets of growing goats and sheep (Sultana et al. 2015; Yusuf et al. 2016; Zaher et al. 2020). Therefore, there is a need to assess the response of these goats to Moringa oleifera herbage supplementation before and after kidding; during lactation, and its ",
Rumen function in vivo and in vitro in sheep fed Leucaena leucocephala,https://doi.org/10.1007/s11250-015-0790-y,,,Tropical fodder;Sheep;Intake;Methane,"The effect of Leucaena leucocephala inclusion in sheep diets upon rumen function was evaluated. Nine Pelibuey sheep, 32.6 ± 5.33 kg live weight (LW), fitted with rumen cannula were used. A complete randomized block design was employed. Two experimental periods of 60 days each, with 60-day intervals between them, were used. Experimental treatments were as follows (n = 6): T1 (control), 100 % Pennisetum purpureum grass; T2, 20 % L. leucocephala + 80 % P. purpureum; T3, 40 % L. leucocephala + 60 % P. purpureum. In situ rumen neutral detergent fiber (aNDF) and crude protein (CP) degradation, dry matter intake (DMI), volatile fatty acids (VFA) production, estimated methane (CH4) yield, rumen pH, ammonia nitrogen (N-NH3), and protozoa counts were measured. The aNDF in situ rumen degradation of P. purpureum and leucaena was higher (P < 0.05) in T2 and T3. Leucaena CP degradation was higher in T2 and T3 but for P. purpureum it was only significantly higher in T3. Leucaena aNDF and CP degradation rate (c) was 50 % higher (P < 0.05) in T2 and T3, but only higher in T3 for P. purpureum. Voluntary intake and rumen (N-NH3) was higher in T2 and T3 (P = 0.0001, P = 0.005, respectively). Molar VFA proportions were similar for all treatments (P > 0.05). Protozoa counts and in vitro gas production (48 h) were lower in T2 and T3 (P < 0.05, P < 0.0001). Estimated methane yield (mol CH4/day) was higher in sheep fed leucaena (P < 0.0001). However, CH4 yield relative to animal performance (mol CH4/g LW gain) was lower in T2 and T3 (P < 0.0001). In summary, these results indicate that including L. leucocephala in sheep diets did not modify rumen fermentation pattern (same VFA ratios) nor reduce the amount of CH4 per unit of DMI (mol CH4/g DMI). However, leucaena inclusion does increase rumen N-NH3, aNDF and CP digestibility, and voluntary intake.",
Sweet potato (Ipomoea batatas) vine silage: a cost-effective supplement for milk production in smallholder dairy-farming systems of East Africa?,https://doi.org/10.1071/AN18743,,,"economic, evaluation, feed preservation, non-conventional feed, rain-fed system, tropical agriculture","Context: Dairy production in East Africa is dominated by smallholder production systems, but is dogged by suboptimal milk production mediated by poor nutrition. Grain-based concentrates can be used to make the energy and protein deficits in rain-fed systems, but this strategy faces several hurdles. For livestock production systems to be sustainable, it is important that less human-edible food is fed to animals and sweet potato can serve both as a source of human food (tuber) and animal feed (vines). Smallholder scale-appropriate technology has been used to allow feed preservation of the perishable sweet potato vines for use throughout the year.

Aims: We assessed the efficacy of sweet potato vine silage plus wheat bran (SPVSWB) as a supplement to maintain milk production at a lower cost than that of grain-based commercial dairy concentrate (CDC).

Methods: Multiparous Holstein–Friesian cattle (n = 12) were given a basal diet of Napier grass (Pennisetum purpureum cv. South Africa), ad libitum, plus a fixed amount of either SPVSWB or CDC, (designed to be both iso-nitrogenous and iso-caloric) during late (LL) and early (EL) lactations.

Key results: Daily milk yield was lower for SPVSWB than for CDC groups, although comparable (not significant), in both LL (6.2 vs 7.5 L/day) and EL (14.2 vs 16.0 L/day); however, the lower cost of production for SPVSWB (23.2 vs 48.7 KES/kg DM) ensured that margins on milk income over feed (per cow per day) were greater for SPVSWB in both periods. (LL: 71 vs 14.5; and EL: 426 vs 400 KES/day). The lower intake for SPVSWB than for CDC is most probably due to high neutral detergent fibre content in the supplement and the lower milk production, owing to either, or both, of lower energy and protein intake.

Conclusions: It is suggested that some reformulation of SPVS, replacing in part or in whole the Napier grass with rejected sweet potato tubers, will decrease the neutral detergent fibre content, increase the metabolisable energy content, reducing the need for additional wheat bran and may, thereby, enhance the production response to equate with that of CDC.

Implications: It is clear that, despite SPVSWB eliciting lower milk production (LL 6.2 and EL14.2 L/day) than does CDC (LL 7.5 and EL 16.0 L/day), SPVSWB is a cost-effective, accessible alternative to grain-based supplementation in small-holder dairy-farming systems of Kenya.",
The ability of tanniniferous legumes to reduce methane production and enhance feed utilization in Barki rams: in vitro and in vivo evaluation,https://doi.org/10.1016/j.smallrumres.2020.106259,,,Barki rams;Berseem hay;Methane emission;Ruminal fermentation;Tanniniferous plants,"Two experiments (in vitro and in vivo evaluation) were conducted to evaluate the ability of three different tanniniferous legumes to replace berseem hay on ruminal fermentation, digestibility and methane (CH4) emission. Berseem (Trifolium alexandrinum L.) hay (BH) was considered as control, or replaced at 50 % with Acacia saligna (AS), Leucaena leucocephala (LL) or Atriplex halimus (AH) on a DM basis. In Experiment 1 (in vitro evaluation), in vitro ruminal degradability, gas and CH4 production were measured. In Experiment 2 (in vivo evaluation), twelve Barki rams weighing 43.29 ± 0.13 kg were randomly assigned into 4 treatments and individually fed the BH, AS and LL diets for 30 days (21 days for adaptation, 7 days for digestibility and N balance and the subsequent 2 days for CH4 measurements). Results of Experiment 1 showed that AS, LL and AH diets decreased (P < 0.05) gas, CH4 and total protozoa compared to BH. Both AS and LL diets increased (P < 0.05) ruminal propionate and partitioning factor, while decreased, ammonia-N (NH3-N) concentrations, acetate, acetate/propionate ratio and protozoa count compared to the BH diet. In Experiment 2, the LL diet decreased (P < 0.05) dry matter intake and digestibility of crude protein compared with the BH diet. Rams fed both AS and LL diets showed greater (P < 0.05) fecal N and retained N, while decreased (P < 0.01) urinary N excretion and exhibited 11.45 % reductions in CH4 production. In conclusion, the partial replacement of BH with AS reduced N losses and CH4 emissions without negative effects on ruminal fermentation.",
The effects of Brachiaria grass cultivars on lactation performance of dairy cattle in Kenya,NA,,,NA,"Brachiaria grass is a high quality tropical grass native to East and Central Africa. It is widely grown for grazing, hay and silage making in South America, Australia and East Asia. An on-farm feeding trial was carried out in Kangundo sub County in Machakos County in mid-altitude eastern region of Kenya to evaluate the effects of feeding Brachiaria cultivars on milk yield. Twelve farmers fed cows on either Brachiaria brizantha cvs. Piata, Xaraes and MG4 or B. decumbens cv. Basilisk. A total of 12 dairy cows in mid lactation (between 3 and 6 months into lactation) were used. Milk yield increased by 15-40% in cows fed Brachiaria grasses compared to local feeds which were varied mixtures of Napier grass, maize stover and natural pastures. A second study was conducted at KALRO Mtwapa in coastal lowlands to evaluate the effect of Mulato II, Piata and Xaraes on milk production. Sixteen (16) Jersey cows in mid to late lactation were grouped into four and fed on either Mulato II, Piata, Xaraes or Bana as the control. There were no differences (P>0.05) between the daily grass dry matter intake which ranged from 5.7 to 6.4 kg/cow. Daily milk yield was similar between cows fed Bana (4.6 kg/cow) and Piata (4.7 kg/cow). However, cows fed on either Mulato II or Xaraes produced less (P<0.05) milk (4.4 and 3.6 kg/cow respectively) than cows fed Bana (4.6 kg/cow). The study concluded that; compared to local feeds in Kangundo sub County, Brachiaria increased milk by 15-40%. It also has potential to compliment Napier grass in dairy feeding in coastal Kenya. Farmers should be encouraged to grow more Brachiaria for increased milk production.",Conference paper
Use of Prosopis juliflora seedpod as livestock feed supplement in the arid and semi-arid rangelands of Kenya,NA,,,NA,"Trees and shrubs have provided many benefits. Currently these are disappearing in the arid and semi-arid areas of Kenya and affecting the livelihoods of pastoralist depending on livestock production. The climate change will affect it further. The trees and shrubs are under serious threat, especially in the Sahelian zone, owing to increased periodic droughts, rapid increase of population leading to overexploitation. The aim of the study is to assess the feasibility of incorporating Prosopis juliflora seedpods into a typical dryland livestock production system. Twenty weaner Galla goats of similar age (6 months) and weights (11–14 kg) were randomly assigned to four treatments of five weaners each. The treatments were PJP0- No P. juliflora (control treatment), PJP100- (100 g/goat/day P. juliflora), PJP200 (200 g/goat/day P. juliflora), and PJP400 (400 g/goat/day P. juliflora). The experiment lasted for 70 days. All the treatment groups exhibited higher average weekly weight gains than PJP0 (control) throughout the experimental period. However, for the first 3 weeks, these differences were not statistically significant (P < 0.05). From the fifth week onwards, however, the differences in growth rates were statistically significant (P < 0.05). Treatment PJP200 exhibited the highest total weight gain (3.96 kg), followed by PJP400 (2.70 kg). Group PJP0 had lowest weight by the end of the experiment. This study demonstrated that P. juliflora could be used as goats feed up to 200 g/goat/day giving good weight gains and no negative effects on feed intakes and digestibility.",Book
